,,作者,题名,文献来源,年,卷,期,页码,ISSN,关键词,机构,摘要
110,C,高岩;吴耀武;,高校辅导员工作压力分析及其调适――基于陕西省高校样本的实证研究,湖北社会科学,2015,No.344,8,165-169,1003-8477,辅导员;工作压力;调查研究,西安外国语大学;,"高校辅导员是大学生思想政治工作的主要力量,对于大学生的健康成长起着重要的作用,他们的身心健康关系着高等教育和高校的发展。调查结果显示,尽管不同性别、年龄、婚姻、工龄和学校类别的教师在工作压力上有所差异,但高校辅导员普遍存在着较大的工作压力,因此,高校和社会应该予以重视,可通过提升抗压能力、针对群体引导、建立帮助机构和建设组织文化等途径以维护高校辅导员的心理健康。"
111,C,张莉;鲁萍;杜涛;,高校辅导员职业能力提升与专业化发展研究,思想理论教育导刊,2015,No.200,8,130-132,1009-2528,辅导员;职业能力;专业化;提升;发展,对外经济贸易大学学生工作部;对外经济贸易大学后勤管理处;,"辅导员是开展大学生思想政治教育的骨干力量,辅导员的职业能力提升与专业化发展是当前对高校辅导员队伍建设提出的重要要求,对提升学生工作质量,加强辅导员职业认同,优化辅导员职业路径具有关键作用。当前,部分高校存在辅导员角色定位不明、良性竞争平台较缺乏,辅导员培养机制和行业体制待健全等问题。高校应通过科学定义辅导员角色,完善专业化发展制度;加强专业化培养建设,保障辅导员职业发展;完善行业体制,激发行业活力,不断提高辅导员队伍的整体素质和工作水平,进而加强辅导员自身职业能力和专业化发展,提高育人工作水平。"
112,C,金文斌;邹斌;,整体性视域下高校辅导员专业化发展,中国高等教育,2015,No.547,Z2,68-70,1002-4417,辅导员专业化;思想政治教育;队伍专业化;日常教育管理;纪律意识;本源性;辅导员职责;辅导员制度;语言文字能力;路径探索;,安庆师范学院政治学院;,"辅导员专业化是国家、社会、高校关注的话题,关系到大学生思想政治教育的有效性。厘清辅导员""是什么、为什么、干什么、学什么""的本源性问题,有助于明确辅导员科学发展的方向。辅导员专业化发展需考虑支持体系、培训体系和标准体系的相互关系,三者统一于专业化发展的整体范畴。"
113,C,张向红;,组织结构视域下高校辅导员核心竞争力弱化及其对策,江苏高教,2015,No.183,5,92-94,1003-8418,高校;辅导员;组织结构;核心竞争力,马鞍山职业技术学院经济贸易系;,"我国高校辅导员治理结构中,战略高层专业化顶层设计缺失,中间线结构专业化导向弱化,技术结构职能单向化,支持结构角色错位,是导致辅导员核心竞争力弱化的重要原因。高校提升辅导员核心竞争力就应从上述方面入手,推动辅导员治理结构的优化,进而提高学生德育工作管理成效。"
114,C,于成文;,基于职业自觉视角浅谈高校辅导员工作,思想理论教育导刊,2015,No.201,9,126-129,1009-2528,高校辅导员;职业自觉;职业认同,北京科技大学学生工作部;,"高校辅导员是开展大学生思想政治工作的骨干力量。职业自觉是辅导员应该坚持的职业素质和品质。面对新的形势和要求,辅导员应该进一步增强历史责任感和使命感,努力强化职业自觉,回归育人本质,注重创新,出色践行岗位职责,切实提高育人实效。"
115,C,孙正林;,辅导员职能定位重构与大学人文精神培育,国家教育行政学院学报,2015,No.215,11,10月13日,1672-4038,辅导员;教育力;人文精神,东北林业大学;,"人文精神培育是大学教育应有之义。受社会文化结构转型、科技理性过度膨胀、传统人文价值理念断裂、数字化生活模式普及等因素制约,大学人文精神培育陷入困境,引发大学生一系列问题。辅导员教育力的优势契合了人文精神培育的需求,从而使辅导员成为人文精神培育的重要力量。加强辅导员队伍建设,提升辅导员教育力,成为大学人文精神培育的必要之选。"
116,C,单德伟;强飙;,再论高校辅导员职业化、专业化的实现路径,江苏高教,2015,No.184,6,141-143,1003-8418,高校辅导员;职业化;专业化;路径,南京审计学院泽园书院;南京审计学院学务委员会;,"辅导员职业化、专业化是高校人才培养和辅导员个人自身发展的统一,也是辅导员专家化培养的基本要求,对当下辅导员职业存在的合法性、管理的合理性和工作运行的效能都有重要意义。目前,辅导员职业化、专业化发展仍面临职业认同、工作领域、发展路径、职称晋升等一系列困境,需要从制度设计、管理体制、运行机制三层路径同时推进。"
117,C,曲建武;吴云志;,发挥辅导员在高校哲学社会科学课程教学中的育人作用,东北师大学报(哲学社会科学版),2015,No.278,6,228-231,1001-6201,辅导员;哲学社会科学;课程教学,大连海事大学马克思主义学院;,"辅导员是高等学校教师队伍和管理队伍的重要组成部分,具有教师和干部的双重身份。因此,辅导员不仅要重视大学生日常思想政治教育和管理工作,而且要通过课堂教学对大学生进行哲学社会科学教育。笔者从辅导员在高校哲学社会科学课程教学中发挥育人作用的现状入手,对辅导员承担高校哲学社会科学课程教学的可能性、必要性和具体措施进行了较为系统的阐述。"
118,C,蒋福玲;肖维;,徐特立“双师”教育思想与高校辅导员团队建设的方向,大学教育科学,2015,No.154,6,90-93,1672-0717,徐特立;“双师”教育思想;辅导员团队;建设方向,长沙师范学院音乐舞蹈系;,"徐特立先生""经师人师合二为一""的""双师""教育思想可以为高校辅导员团队建设提供重要的发展方向,有效增强大学生思想政治教育工作的实效。以徐特立的""双师""教育思想为指导,开展""经师+人师""型辅导员团队建设,具体包括:其一,打造团队精神和团队文化,拓宽团队成员的学习培训和实践成长渠道,提高团队成员自身的思想政治素质和学生德育工作能力等""人师""水平,提高团队成员的专业知识涵养、学生管理能力和科学研究能力等""经师""水平,培育德才兼备的""双师""型辅导员;其二,将""双师""教育思想落实到每个辅导员的日常工作当中,创新学生思想政治教育工作平台,面向学生开展个性化特色辅导和主题教育活动,引导学生将专业学习和德育实践结合起来,提高大学生的专业能力和德育水平,培养德艺双馨的大学生。"
119,C,朱新华;,手机媒体时代辅导员话语范式的转换,思想理论教育导刊,2015,No.204,12,127-129,1009-2528,手机媒体;辅导员;话语范式;转换,安庆师范学院政法学院;,"随着手机媒体信息传播的快速发展和语境的变迁,手机媒体的无屏障性、交互性、开放性和自主性等特点对辅导员话语范式产生了挑战。必然要求通过创新,从辅导员话语体系、话语交往原则、话语方式和话语形式等方面重构辅导员话语新范式,重新定位辅导员话语的价值诉求。"
120,C,薛俊义;,社会领域分化与职业分工――高校辅导员职业道德形成的社会根源,湖北社会科学,2015,No.348,12,152-157,1003-8477,辅导员;社会分工;职业道德;专业化,盐城工学院党委人武部;,"高校辅导员群体是教育专业化体系的重要组成部分,在高校学生工作管理系统中发挥重要的作用,高校辅导员职能的发挥离不开良好的职业道德支撑。涂尔干的社会劳动分工理论分析了职业团体和职业道德形成的社会原因,其中的一些论断有助于理解高校辅导员职业道德形成的社会根源。特别是在当前社会政治经济大环境和高校""生态场域""的现实局面中,考察高校辅导员的职业道德形成与发展问题具有重要的现实意义。"
121,C,刘世勇;李姣艳;王林清;,高校辅导员职业认同现状研究,湖北社会科学,2016,No.349,1,178-181,1003-8477,高校辅导员;职业认同;现状;差异分析;提升,中国地质大学;,"高校辅导员职业认同是辅导员队伍职业化专家化建设的基础。通过问卷调查法和统计分析法,对高校辅导员职业认同的现状进行了调查和分析,得出高校辅导员职业认同总体水平较高,在人口学变量上,职业认同都有差异但不显著,仅在职业认同的某些维度有显著差异的结论。随着高校辅导员职业认同的不断提升,高校辅导员必然会走上职业化专家化发展道路。"
122,,杨建义;,高校辅导员身份定位与建构,思想教育研究,2011,No.190,1,83-87,1002-5707,高校辅导员;身份认同;建构,福建师范大学学生工作部;,"科学确定辅导员职业定位不仅关系到辅导员自身成长发展,而且关系整个辅导员队伍专业化、职业化建设。要着力寻找辅导员身份定位与建构的教育根基,着眼于辅导员岗位的学术培育、职业建设和专业发展,突破辅导员身份认同的困惑和冲突,为辅导员的专业化、职业化建设提供良好的学理支持。"
123,,曲长海;,试析高校辅导员专业化建设的自我实现,黑龙江高教研究,2011,No.201,1,86-87,1003-2614,高校辅导员;专业化;自我实现,黑龙江科技学院电气与信息工程学院;,"高校辅导员是高校学生日常思想政治教育和管理工作的组织者、实施者和指导者,其专业化水平直接关系到大学生思想政治工作的实效性。文章从高校辅导员自身实际出发,提出了自我实现专业化的对策与建议,以期为高校辅导员实现专业化提供参考。"
124,,韩才义;巨能攀;,浅析高校辅导员专业化发展的取向和理念,教育探索,2011,No.235,1,115-116,1002-0845,高校辅导员专业化;发展取向;教育理念,成都理工大学环境与土木工程学院;,"教师专业化已成为世界教育改革的发展趋势,确立专业化发展取向是辅导员队伍建设的重要内容。在关注专业化发展取向的同时,应从不同的层面上建构先进的教育理念,以先进的教育理念为引领,优化高校辅导员的专业结构和专业素养,实现教师学生的共同成长。"
125,,吴刚;,宽泛与局限:高校辅导员发展之困惑,黑龙江高教研究,2011,No.203,3,77-79,1003-2614,辅导员队伍;职业化宽泛;专业化局限;政策建议,广东金融学院;,"职业化宽泛与专业化局限对高校辅导员的发展产生直接影响。因此,进一步理顺职业化与专业化的辩证关系,弄清它们交互关系与影响脉络,给出相应的政策建议,期望对辅导员队伍建设起到积极作用。"
126,,邹积英;徐润生;关丽;,高校辅导员队伍建设的理性思考,教育探索,2011,No.236,2,112-113,1002-0845,辅导员;队伍建设;理性思考,大连工业大学;,"辅导员作为大学生健康成长的指导者和引路人,其地位和作用已越来越凸显了出来,但目前辅导员队伍建设还处在需要进一步探索的阶段,还存在一些亟待解决的问题。进一步加强辅导员队伍建设,必须明确辅导员的角色定位,严格辅导员队伍的准入制度,规范辅导员的培训办法,建立对辅导员的评价体系,完善对辅导员的激励机制。"
127,,刘世勇;陈莎;,高校辅导员胜任力模型的构建与检验,湖北社会科学,2011,No.291,3,168-170,1003-8477,高校辅导员;胜任力模型;构建;检验,中国地质大学应用心理学研究所;,"研究高校辅导员胜任力的构成,对促进高校辅导员的职业化、专业化和专家化发展及高校学生工作的科学化、规范化和制度化建设具有非常重要的意义。本研究基于访谈法、问卷调查法和统计法,构建并检验了高校辅导员胜任力模型。得出高校胜任力模型由认知特征、服务特征、影响特征、专业知识、个性特征、专业技能、成就特征、培养学生共8个因素构成。验证性因素分析结果显示模型拟合良好。问卷的项目区分度、信度和效度达到了统计学要求的较好水平。"
128,,李斌;,胜任力模型与地方高校辅导员人力资源管理研究,湖南社会科学,2011,No.143,1,145-147,1009-5675,胜任力模型;地方高校;辅导员;人力资源管理,湖南城市学院团委;,"胜任力模型是目前人力资源管理理论中最先进的模型之一,是涉及岗位描述、人才选拔、工作评价、培训、薪酬等多个方面的基础性关键模型。研究地方高校辅导员的胜任力模型,关系到地方高校辅导员的选聘标准、职责、培训体系、考核机制等各个方面,因而具有重要的理论意义和现实指导意义。"
129,,,重视高校辅导员队伍建设 加强和改进大学生思想政治教育工作,思想教育研究,2011,No.192,3,8月9日,1002-5707,思想政治教育;校党委书记;辅导员岗位;专职辅导员;优秀辅导员;辅导员管理;学生工作;全国会议;整体精神面貌;发展规划;,黑龙江省教育厅学生处;,"一、高度重视辅导员队伍建设,认真贯彻落实全国工作会议精神和教育部24号令黑龙江省高度重视辅导员队伍建设,认真学习领会全国会议精神,认真抓好24号令的贯彻落实工作。成立了全省高校辅导员队伍建设领导小组,研究起草辅导员队伍建设实施意见和发展规划。召开了全省高校党委书记、校长会议,提出把辅导员队伍建设工作作为高校""一把手""工程,党"
130,,陈静;,高校辅导员工作倦怠状况调查研究,思想教育研究,2011,No.192,3,82-85,1002-5707,高校;辅导员;工作倦怠,广东商学院学生处;,"高校辅导员的工作倦怠主要表现在精力枯竭、工作意义感丧失、热情枯竭、工作成就感降低等方面。影响辅导员工作倦怠的因素主要有辅导员自身的性别、年龄、工作年限、学历水平以及辅导员所在高校的类型等方面。解决高校辅导员的工作倦怠问题,必须明确辅导员的工作职责,提升辅导员的职业认同感、增强其自身心理调节能力。"
131,,张晓娜;周亚夫;,高校辅导员队伍专业化建设探讨,教育探索,2011,No.238,4,109-110,1002-0845,高校;辅导员队伍;专业化建设,南京医科大学基础医学院;,"高校辅导员队伍专业化是现代教育发展趋势的必然选择,是保证高校学生培养质量的迫切要求,也是高校辅导员群体自身发展的现实需要。高校应采取严把入口关、精心选聘,明确职责、合理任用,科学培养、促进成长,提供空间、保证发展等措施,推进辅导员队伍的专业化建设。"
132,,陈灿芬;,地方高校辅导员职业发展的困惑与思考,教育探索,2011,No.238,4,111-112,1002-0845,地方高校;辅导员职业发展;困惑与思考,湖南人文科技学院美术系;,"地方高校辅导员职业发展的困惑主要体现在辅导员兼职过多、工作任务繁重、工作待遇差等方面。为此,应搭建有利于促进辅导员职业发展的平台,建立科学的辅导员管理体系,加强辅导员队伍的专业化建设,使辅导员明确发展方向,为辅导员解决实际问题,建立并完善辅导员的考核制度,引导辅导员走上专业化、职业化和终身化的道路。"
133,,,教育部高校辅导员培训和研修基地(广西师范大学)简介,思想教育研究,2011,No.193,4,114,1002-5707,辅导员培训;研修基地;基地建设;优秀辅导员;校党委;校内外专家;学生工作部;职业认同;授课教师;专家指导委员会;,,"教育部高校辅导员研修和培训基地(广西师范大学)是首批21个教育部高校辅导员培训和研修基地之一。基地主要承担广西高校辅导员岗前培训、骨干培训、高级研修、日常专题培训和学历教育,具有培训、科研和咨"
134,,季景书;沈自友;,高校学生辅导员队伍职业发展模式刍议,人口与经济,2011,,S1,140-141,1000-4149,学生辅导员;职业化建设;职业化发展;职业化进程;发展模型;发展理论;大学生健康;西方文化思潮;教育目标;价值取向;,北京工业大学;,"高校学生辅导员队伍职业发展模式构建是突破职业发展困境,实现职业化建设的有效途径,也是新形势下大力加强学生辅导员队伍建设的必然要求。运用职业发展理论,建构学生辅导员队伍职业发展模型,进而提出职业发展模式的构建策略,对推动学生辅导员队伍的职业化建设进程"
135,,,辽宁大学辅导员基地简介(教育部暨辽宁省高校辅导员培训和研修基地[辽宁大学]),高校理论战线,2011,,5,66,1002-4409,研修基地;辅导员培训;大学辅导员;辽宁大学;思想政治教育;辽宁省高校;省级重点学科;马克思主义理论;博士学位授权;政治素质;,,"教育部暨辽宁省高校辅导员培训和研修基地于2007年在辽宁大学建立。该基地现有马克思主义理论和思想政治教育2个博士学位授权点,思想政治教育等2个省级重点学科,有博士生导师7"
136,,唐昌维;,谈西部地区独立院校辅导员队伍专业化建设的长效机制,教育探索,2011,No.239,5,119-120,1002-0845,独立院校辅导员;专业化发展;长效机制,贵州财经学院资源与环境管理学院;,"西部地区独立院校跟其他院校一样,也必须建立起一支具有较高专业素质的辅导员队伍。独立本科院校又有其特殊性,需要构建和实施一系列具有前瞻性的专职辅导员专业化建设的长效机制,借以确保辅导员队伍的稳定,同时促进其专业化发展。"
137,,施益华;,高校辅导员就业指导知识结构研究,教育探索,2011,No.239,5,123-124,1002-0845,高校辅导员;就业指导;知识结构,浙江传媒学院动画学院;,"高校辅导员在当前迫切需要加强就业指导能力建设,特别要健全就业指导知识结构。其就业指导知识结构包括三个方面的内容:本体性知识、条件性知识和实践性知识。高校辅导员就业指导过程中,要努力完善这三方面知识的结构,构建具有自身特点的就业指导工作方法体系,做好学生就业指导服务工作。"
138,,邹积英;关丽;徐润生;,关于建立高校辅导员工作绩效考核制度的思考,教育探索,2011,No.239,5,136-137,1002-0845,高校辅导员绩效考核;原则;制度,大连工业大学;,"对辅导员的工作绩效进行考核,应坚持定性与定量相结合、点与面相结合、将常规性工作与创新性工作相结合、将工作过程与工作效果相结合及将考核结果与对辅导员的奖惩相结合等原则。辅导员工作绩效考核制度的建立,应当包括辅导员工作的责任目标体系、对辅导员的工作进行考核的指标体系、科学而合理的评价体系以及有效的对考核结果的反馈和利用机制几方面内容。"
139,,尹忠恺;顾红;,浅议高校辅导员队伍的专业化职业化建设,中国人力资源开发,2011,No.247,1,104-106,1004-4124,辅导员队伍;职业化;路径选择,辽宁工程技术大学;,"针对目前高校辅导员队伍普遍存在的职责不清、素质欠佳,队伍不稳定等问题,本文提出了加强职业理想教育、提高专业化培养力度、建立健全考核评价机制以及成立高校辅导员协会等辅导员队伍职业化建设思路。"
140,,孙峻峰;,高校辅导员应具备的教育领导特质结构,黑龙江高教研究,2011,No.207,7,86-89,1003-2614,高校;辅导员;教育领导特质;结构,哈尔滨师范大学辅导员培训和研修基地;,"高校辅导员是高等学校教师队伍和管理干部队伍的重要组成部分,具有教师和干部的双重身份。不论从教师的角度,还是干部的角度,高校辅导员都是高校教育领导者中重要的一员。高校辅导员教育领导特质的高低,直接关系到高校的办学方向和办学宗旨,关系到人才培养的质量,关系到国家和民族的未来。文章认为,高校辅导员教育领导特质应由自然特质、情感特质、认知特质、道德特质、技能特质、动机特质等六个方面构成。其中自然特质是基础,是其他特质产生的前提;情感特质是与个人的性格特征相联系的,与认知特质和道德特质一起构成一个金字塔,共同影响领导者的领导方式和领导行为,情感特质位于金字塔的塔顶;从认知特质又派生出技能特质,从道德特质又派生出动机特质。"
141,,林路生;孙铭薇;黄祖辉;,网络环境下高校辅导员的信息素质及其培养策略,黑龙江高教研究,2011,No.207,7,90-92,1003-2614,网络环境;思想政治教育;辅导员;信息素质,广东医学院东莞校区第二临床学院;,"高校辅导员信息素质是决定现代思想政治教育针对性和实效性的重要因素之一。高校辅导员的信息素质的内涵非常广泛,既包括对学生网络语言背后的话语兴趣点与审美旨趣的观察,思想道德现状与发展趋势的分析和判断,也包括与学生的网络沟通、交往以及正确引导学生话语方向和思想走向,从而提高学生的思想境界的能力和素养。提高辅导员的信息素质是适应新时期现代思想政治教育的内在必然要求。"
142,,李伟群;,新形势下研究生辅导员队伍建设的向度与维度,思想教育研究,2011,No.195,6,106-108,1002-5707,研究生;辅导员;队伍建设;向度;维度,华南理工大学机械与汽车工程学院;,"研究生辅导员队伍建设应该以研究生成长成才的需求为向度,要认真研究社会发展、高等教育变革和研究生人群结构变化等因素引起的研究生需求变化的新特点,注重从组织结构、组织文化、职业素养、评价体系等维度加强研究生辅导员队伍建设。"
143,,张爱林;周亚夫;,高校辅导员的知识结构及其优化,思想教育研究,2011,No.195,6,109-111,1002-5707,辅导员;知识结构;功能优化,南京医科大学党委办公室;,"作为思想政治教育的骨干力量,高校辅导员工作职责涉及大学生的思想引领、学习指导、生活辅导、心理疏导、生涯规划等诸多事宜。辅导员必须建立合理的知识体系并优化其知识结构,走职业化、专家化、专业化发展之路。只有这样才能更好地适应工作要求,完成工作任务。"
144,,刘娟;,高校辅导员的法律意识浅论,天府新论,2011,No.160,4,156-159,1004-0633,辅导员;法律意识;法律知识,西南交通大学信息科学与技术学院;,"辅导员是高等学校教师队伍和管理队伍的重要组成部分,具有教师和干部的双重身份。他们是学生的管理和综合素质的培养的主要实施者,也是和学生的成人成才联系最为密切的人。近年来,高校与学生管理纠纷增多,并越来越复杂化,辅导员作为与学生最近的管理者,其本人的法律意识常常决定了纠纷的产生和纠纷处理的发展方向。研究辅导员的法律意识的现状及问题,找到解决问题的途径和对策,有助于辅导员了解法律意识的真正含义,有助于辅导员法律意识的提高,有助于高校和辅导员避免在工作中遇到的法律风险,有助于减少高校与学生管理的纠纷,有助于维护大学生的合法权利,有助于提高大学生的法律意识。"
145,,赵玉宝;张倩;冯晓华;,从众理论对高校辅导员工作的启示,东北师大学报(哲学社会科学版),2011,No.252,4,277-279,1001-6201,大学生从众心理;积极从众;消极从众;启示,东北师范大学计算机学院;长春特殊教育师范学校;,"我国目前正处于社会转型期,当代大学生在其影响下涌现出许多从众现象。大学生从众心理主要体现在消费从众、学习从众、恋爱从众、择业从众和行为从众。理性从众对大学生成长发挥积极作用,而盲目从众则抑制大学生的主体发展。从众理论启示高校辅导员在实际工作中应重视榜样作用;以奖惩影响趋势;鼓励独立思考和标新立异,辨别是非能力;关注大学生心理健康教育,培养乐观积极的生活态度。"
146,,何菊仙;,高校辅导员“职业高原”问题的成因与对策,思想教育研究,2011,No.196,7,96-98,1002-5707,高校;辅导员;职业高原,浙江医学高等专科学校;,"高校辅导员""职业高原""现象是其职业生涯中值得注意的重要问题之一。由于职业角色、身份和对象的特殊性,高校辅导员是""职业高原""的高发人群。分析高校辅导员发生""职业高原""的成因,可以从依托组织优势、细化工作内涵、把握个体特征等方面缓解其""职业高原""问题,促进辅导员队伍建设。"
147,,张效英;钟军;叶绍灿;田合雷;,高校新任辅导员专业化发展问题及对策,思想教育研究,2011,No.196,7,99-101,1002-5707,高校;新任辅导员;队伍建设;专业化,合肥工业大学党政办公室;合肥工业大学学生工作部;合肥工业大学生物与食品工程学院;合肥工业大学团委;,"高校新任辅导员专业化发展问题是新任辅导员队伍建设的核心问题。通过对高校新任辅导员专业化发展现状的调查和分析可以发现,高校应当通过建立职业素质提升平台、工作分类培养平台、课程化与项目化平台、可持续发展平台等措施来加强新任辅导员专业化发展,建设高素质辅导员队伍。"
