,,作者,题名,文献来源,年,卷,期,页码,ISSN,关键词,机构,摘要
222,,柏路;,关于提升辅导员科研能力的思考,思想教育研究,2012,No.213,10,78-81,1002-5707,高校;辅导员;专业化;科研能力,东北师范大学思想政治教育研究中心;,"新时期高校辅导员队伍的专业化发展对辅导员科研能力提出了更高的要求。明确辅导员科研能力的主要地位,准确把握辅导员科研能力的内涵,深入研究培育辅导员科研能力的方法与途径,是当前提升辅导员科研能力需要着重解决的三个问题。"
223,,任开蕾;武娟;,辅导员工作中道德两难问题初探,思想理论教育,2012,No.389,21,84-87,1007-192X,辅导员工作;道德两难;应对思路,华东师范大学学工部;华东师范大学公共管理学院;,"辅导员工作中的道德两难问题,是指在辅导员的工作职责范围内,当辅导员面对复杂的工作情境和多重的价值准则,从对学生负责的角度出发,选择任何一种解决方案,都存在价值选择缺憾的情况。问题产生的原因在于社会环境的复杂性、制度规范的相对性、价值标准的多元性、辅导员社会角色的差异性和主观认知水平的有限性。解决两难问题的主要原则包括德性发展优于学业进步,保障安全高于鼓励个性、高于遵循规范,善的目的平衡恶的手段等三个方面,同时应以境遇伦理学的相关理论作为解决问题的补充思路。"
224,,姜汪维;,辅导员在大学生危机事件管理中的角色,山西财经大学学报,2012,v.34;No.237,S4,101,1007-9556,高等学校;大学生;危机管理;辅导员,石河子大学药学院;,"高校管理的科层化和条块化造成了大学危机事件管理的死角,而辅导员的特殊角色和作用可以有效弥补这一缺陷。文章认为,辅导员应当扮演好""预防针""和""扫描仪""、""发言人""和""救火队""以及""创可贴""和""煲鸡汤""的角色,保持教育者的姿态,树立良好的品牌形象,提高大学生危机事件管理有效性和针对性。"
225,,王莹;,艺术院校辅导员职业倦怠研究,山西财经大学学报,2012,v.34;No.237,S4,127,1007-9556,艺术院校;辅导员;职业倦怠,中国戏曲学院;,"文章认为艺术院校辅导员队伍起步晚,工作繁琐不容易出成果,高期望的价值冲突与实际脱离较大等是艺术院校辅导员职业倦怠现象的成因,学校应高度重视并建立合理考评体系,建立专兼结合的辅导员工作队伍,为辅导员做好职业规划,解除辅导员的后顾之忧,才能解决辅导员职业倦怠问题。"
226,,冯刚;,坚持质量导向和内涵发展 努力提高高校辅导员队伍建设科学化水平,思想教育研究,2012,No.214,11,7月10日,1002-5707,高校辅导员;队伍建设;质量导向;内涵发展,教育部思想政治工作司;,"在加强高校辅导员队伍建设的工作中,应当坚持质量导向和内涵发展,按照""立标准、建机制、提质量、促发展""的整体思路,全面推进高校辅导员队伍的科学化建设。具体来说,从确立辅导员岗位职责、职业准入、工作评价和成长发展标准等方面入手,努力抓好辅导员知识体系支撑和培养培训机制建设,提升辅导员工作和队伍建设质量,促进思想政治教育学科和辅导员自身的发展。"
227,,户国栋;,高校辅导员从事思想政治教育工作的三重意识――规律意识、资源意识、网络意识,思想教育研究,2012,No.214,11,102-105,1002-5707,高校辅导员;规律意识;资源意识;网络意识,北京大学学生工作部;,"在提高辅导员能力建设方面,端正和深化思想政治教育工作意识具有重要的意义。树立规律意识是高校辅导员提高能力,从事思想政治工作的先决条件,应转变观念、深化认识、自觉运用规律指导工作,以达到事半功倍的效果;培养资源意识是高校辅导员增强能力,做好思想政治工作的重要准备,应努力开发利用好""有限的""思想政治资源,实现育人工作的""有效性"",以更好地引领和服务大学生成长成才;提高网络意识是高校辅导员完善能力,推动思想政治工作全面发展的新要求,应掌握网络环境""话语权"",争取掌握育人工作的""主动权"",推进立体化的网络思想政治教育平台建设,以达到全面落实覆盖和影响大学生的目的。"
228,,李宗波;李巧灵;,高校辅导员心理契约违背的作用机制――基于社会交换理论的实证研究,中南大学学报(社会科学版),2012,v.18;No.86,6,53-61,1672-3104,高校辅导员;心理契约违背;组织支持感;内部人身份认知;情绪耗竭;工作满意度;社会交换理论,暨南大学管理学院;河南大学教育科学学院;,"从社会交换的视角,探讨心理契约违背对情绪耗竭与工作满意度的影响,以及组织支持感和内部人身份认知的双中介作用。以高校辅导员为研究对象,运用问卷调查法,使用结构方程模型技术进行统计分析,结果表明:心理契约违背对情绪耗竭具有显著的正向影响,对工作满意度则具有显著的负向影响;组织支持感在心理契约违背与内部人身份认知、情绪耗竭、工作满意度之间起部分中介作用;内部人身份认知在心理契约违背与工作满意度之间起部分中介作用,但是在心理契约违背与情绪耗竭之间的中介作用并不显著。研究结果有助于揭开心理契约违背影响机制的黑箱,能够为高校辅导员队伍管理实践提供启示意义。"
229,,陈明霞;,辅导员队伍专业化发展与思想政治教育专业建设,思想教育研究,2012,No.215,12,95-98,1002-5707,辅导员;专业化;思想政治教育;人才培养模式,福建师范大学音乐学院;,"高校辅导员承担了高校大学生的教育、管理和服务工作,对大学生的健康成长发挥着重要作用。目前,高校辅导员队伍存在人员专业结构分散、队伍专业知识不足、专业发展方向偏离等问题,辅导员队伍专业化发展需要以思想政治教育学科为核心,深化思想政治教育专业建设,促进辅导员专业化发展。"
230,,张爵宁;,基于“90后”大学生心理与行为特点的辅导员非权力影响力的培养,学术探索,2012,No.157,12,177-179,1006-723X,高校辅导员;权力性影响力;非权力性影响力;“90后”大学生,南通大学外国语学院;,"辅导员是对在校大学生开展思想政治教育和管理为职业特征的社会角色。辅导员主要通过自己的思想、行为、语言、表情、动作等与学生发生相互作用和相互影响,从而形成职业影响力。辅导员的影响力分为权力性影响力和非权力性影响力,非权力性影响力在学生思想政治教育中占主导地位。本文分析了""90后""大学生心理和行为特点对辅导员发挥非权力影响力的挑战,就如何提升辅导员非权力性影响力提出一定的对策和创新途径。"
231,,陈洁瑾;薛艳;,高职教育变革与辅导员发展的适应性,江苏社会科学,2012,,S1,95-98,1003-8671,高职教育;变革;辅导员;发展适应性,江苏省无锡商业职业技术学院电子工程学院;南京师范大学教育科学学院;,"高职教育变革呈现出对象多样化、培养目标独特性、办学开放性等三大特点。当前高职教育变革与辅导员发展存在诸多不适应现象,高职院校可以从工作方式、成长路经、职后提升、组织设计等方面的专业化角度入手,打造专业化的辅导员团队,解决高职院校辅导员发展适应性问题。"
232,,张小丽;郑浩;胡艳丽;,研究生培养中辅导员与导师合力育人机制研究,思想理论教育,2013,No.393,1,88-91,1007-192X,研究生;导师;辅导员;合力育人,上海交通大学电子信息与电气工程学院;上海交通大学学生工作指导委员会;,"在研究生培养中,导师和辅导员是最重要的两支力量,但各自工作范畴和边界有待进一步厘清,以增强育人合力。构建辅导员与导师合力育人的机制,要明确导师、辅导员、研究生三者互为主体的关系,并不断挖掘辅导员与导师的沟通途径,努力使双方工作相互渗透,并极大地发挥双方优势、克服劣势、抓住机遇,达到合力育人的目的。"
233,,施进华;姚冠新;,高校辅导员绩效评估的实践探索,高校教育管理,2013,v.7;No.37,1,77-80,1673-8381,高校;辅导员;绩效评估,江苏大学党委办公室;盐城工学院;,"辅导员工作的水平和质量直接关系到高校人才培养目标的实现,更对大学生的思想、学习、生活等方面有着不可估量的影响。借鉴管理学中绩效评估理论,建立一套科学合理的辅导员绩效评估体系,能充分调动辅导员工作的积极性、主动性和创造性,提升辅导员的职业素质,提高辅导员从事大学生思想政治教育的工作能力和水平,切实有效推进辅导员队伍的职业化、专业化。"
234,,桑国强;,体育院校辅导员管理行为效益模糊分析,武汉体育学院学报,2013,v.47;No.267,2,81-86,1000-520X,体育院校;辅导员;管理行为;管理效益;模糊分析,温州大学体育学院;,"运用文献资料法、访谈法、问卷调查法、数据挖掘及逻辑推理法对体育院校辅导员不同的管理行为及与学生管理效益之间的关系进行了研究。结果表明,体育院校辅导员所运用的管理行为,主要有规范型、个人情意型、动态平衡型三种;规范型管理行为引起学生对辅导员的心理接受程度较低,降低了管理工作的效益;而动态平衡型管理行为可提高管理工作的效益。而管理效益评价方面,采用规范型管理行为学生支持率普遍较小,而采用动态平衡型管理行为的辅导员学生支持率较高。"
235,,赵祖地;刘允;,当前高校辅导员绩效评估的策略,黑龙江高教研究,2013,v.31;No.226,2,80-82,1003-2614,高校辅导员;绩效评估;问题;原因;对策,南京师范大学;衢州学院;杭州电子科技大学;,"高校辅导员绩效评估对加强辅导员队伍建设起着重要作用。文章在分析高校辅导员绩效评估所存在问题及其原因的基础上,提出改进高校辅导员绩效评估的对策建议:高校辅导员绩效评估应采用多元化、多视角的评估指标来源形式,遵循科学的原则筛选关键评估指标,选用对数加权的方法确定评估指标权重,坚持全方位、多角度地挖掘评估结果潜能。"
236,,吴雷鸣;,高校辅导员工作诗意化教育探析,教育理论与实践,2013,v.33;No.458,3,39-41,1004-633X,高校辅导员;诗意化教育;育人工作;事务性工作,上海出版印刷高等专科学校印刷设备工程系;,"高校辅导员是大学生思想政治教育的骨干力量,是高校学生管理与服务工作的直接实施者、参与者。高校辅导员事务性工作与育人工作的矛盾使高校辅导员的角色发生了冲突与混乱。高校辅导员正确处理好事务性工作与育人工作二者的关系,提高大学生思想政治教育的有效性,必须进一步明晰工作职责,突出事务性工作的教育载体作用;追求诗意化教育,实现理想的育人效果。"
237,,高军;姜德照;,高校突发事件辅导员预控机制的构建,中国行政管理,2013,No.333,3,121-122,1006-0863,高校突发事件;女生宿舍;学生工作;寒假期间;群体性突发事件;应对机制;上海商学院;思想政治教育;网络道德;法制教育工作;,鲁东大学法学院;鲁东大学食品工程学院;,"最近几年来,高校各类大学生突发事件屡屡发生,尤其是2008年上海商学院女生宿舍失火,4名学生为逃生坠楼身亡;2009年校园""甲型H1N1流感""的群体性突发事件;2012年寒假期间广西几所高校大学生假期交通事故伤亡事件以及2012年9月的钓鱼岛涉日游行事件等等,这些高校大学生突发事件的不断出现,对专职从事学生工作的高校辅导员来说,提出了如何构建一个高"
238,,罗炎成;,应然、实然、使然:高校辅导员职业化问题探讨,西南交通大学学报(社会科学版),2013,v.14;No.73,1,104-109,1009-4474,高等学校;高等教育;思想政治教育;辅导员职业化;职业资质;职业道德;职业理想;专任教师专业,漳州师范学院外语系;,"辅导员职业化在职业资质、职业定位、职业能力、职业意识、职业道德等方面有着一定的应然追求。现行高校辅导员职业化的实然分析表明:由于宏观政策的供给不足以及制度安排的缺失,在高校教学、科研、行政三方博弈中辅导员职业化的发展选择始终处于两难境地。基于辅导员职业化的科学发展,建立健全政策供给和制度保障、加快职业化的制度安排、推进职业化文化建设是解决高校辅导员职业化的有效策略。"
239,,麦麦提;,民族高校辅导员工作特点与多元创新实践空间,民族教育研究,2013,v.24;No.114,1,54-57,1001-7178,民族高校;思想政治教育;辅导员工作,中央民族大学少数民族语言文学学院;,"与普通高校相比,民族高校在办学宗旨、教育内容、教育对象等方面具有特殊性。作为民族高校大学生日常管理和思想政治工作的辅导员,应当把握少数民族大学生的思想特点,掌握以少数民族大学生作为工作对象的辅导员工作规律,强化思想政治工作服务育人、管理育人的使命感,在新时期新形势下寻求创新性工作的拓展空间,维护高校民族团结局面乃至全社会的民族和谐与稳定。"
240,,刘艳坤;朱锦秀;邹涛;,大学生对辅导员的期望状况调研――对重庆市10所高校大学生的调查,思想教育研究,2013,No.218,1,97-101,1002-5707,大学生;辅导员;期望,重庆师范大学美术学院;,"辅导员是大学生思想政治教育工作的骨干力量,对大学生的全面发展和成长成才有着不可或缺的作用。文章以重庆市10所高校本科生作为研究样本,围绕""大学生需要什么样的辅导员""展开调研,具体考察大学生对辅导员的总体角色期望、具体特征期望、素质期望、职责期望、工作方式期望等方面的实际状况,从而明确大学生对辅导员的期望和要求,为辅导员队伍专业化、职业化、专家化建设提供必要参考。"
241,,樊泽民;,传承创新团队文化:高校辅导员队伍建设的新命题,思想教育研究,2013,No.218,1,105-107,1002-5707,团队文化;高校辅导员;队伍建设;创新,教育部高等学校社会科学发展研究中心办公室;,"文化是高校的血脉与灵魂。高校辅导员团队文化作为高校校园文化的重要组成部分,表现为物质文化、行为文化、制度文化、理念文化这四个层次与维度。传承创新高校辅导员团队文化要在准确把握高校辅导员团队文化特质的基础上从凝聚目标、完善机制、培养兴趣、推动创新、尊重个性、营造氛围等方面不断推进。"
242,,朱飞;秦永和;马素伟;,学术场域中研究型辅导员的内涵及其培养路径探析,思想教育研究,2013,No.218,1,108-111,1002-5707,学术场域;高校;研究型辅导员,江南大学学生工作处;,"教师和管理者双重身份的不彻底性,使高校学术场域中的辅导员处于尴尬的""边际人""地位,研究型辅导员培养则是改变这一尴尬角色和边际境遇的有效举措。研究型辅导员具有显著的实践导向、自觉的反思意识、强烈的问题意识、浓厚的创新意识以及持续的学习意识等内在特质。可从科研项目政策的倾斜、学术问题意识的养成、高校学科资源的利用以及浓厚科研氛围的营造四个层面入手探索研究型辅导员队伍建设。"
243,,郭孝锋;王子杰;文丽;,演进与创新:辅导员的职能定位与路径选择,理论与改革,2013,No.190,2,175-177,1006-7426,辅导员;工作演进;职能定位,华北电力大学;,"新形势下,辅导员工作在内涵与外延上不断发生着深刻变化,呈现出鲜明的时代特色。全面了解辅导员工作的演变轨迹及特点,准确把握辅导员的职能定位,科学做出辅导员职能有效发挥的路径选择,对突破高校辅导员队伍建设现状,开辟大学生思想政治教育新局面具有特殊重要意义。"
244,,柴渭;赵颖;,以需求变化为导向的高校辅导员队伍建设,学术探索,2013,No.160,3,150-153,1006-723X,高校学生工作;学生主体;辅导员队伍建设,西安交通大学人文学院;西安交通大学仲英书院;,"在中国高等教育进入大众化阶段后,人才培养质量的提升成为高校改革的中心工作。与此相适应,高校学生工作的内涵较之过去发生了显著变化,伴随着教育教学改革、学生群体特征的变化以及社会对人才需求的全面与多元化,使得承担高校学生工作主要任务的辅导员队伍面临新的挑战。如何以学生成长为导向,转变工作理念、调整工作方式、提升工作水平,在高校育人工作中发挥积极有效的作用,是新时期辅导员队伍建设的主要内容和目标。"
245,,刘翔;,构建多源考评体系 优化高校辅导员队伍,中国高等教育,2013,No.495,2,29-30+50,1002-4417,辅导员职业化;考评体系;思想政治教育;个体素质;辅导员岗位;角色定位;职业化发展;教育理念;立德树人;成长需求;,浙江大学党委学生工作部;,"高校辅导员是开展大学生思想政治教育的骨干力量。辅导员考核体系的与时俱进、持续优化是辅导员队伍建设工作的重要内容,是合理评估辅导员工作成效、促进辅导员个体素质不断发展和完善的重要保障,也是推进辅导员职业化、专业化发展的调节器。如何根据辅导员的角色定"
246,,吴月齐;,高校辅导员绩效考核体系若干问题研究,黑龙江高教研究,2013,v.31;No.227,3,49-50,1003-2614,高校;辅导员;绩效考核体系,浙江越秀外国语学院学生处;,"开展高校辅导员绩效考核体系研究,是加强辅导员队伍建设的关键。当前,各高校都还没找到一个切实可行的辅导员绩效考核体系作为参考。文章从主要原则、考核模型、指标体系构建、运作流程等方面对高校辅导员绩效考核体系若干问题进行研究,以期提升辅导员业务水平和工作业绩。"
247,,赵扬;,让制度进发新的“生长力”――高校辅导员队伍专业化、职业化建设的再思考,思想理论教育,2013,No.399,7,82-85,1007-192X,高校辅导员;队伍建设;理念重塑;制度重构,东北师范大学思想政治教育研究中心;,"当前,高校辅导员队伍建设面临诸多""发展起来以后的问题"",要实现新一轮发展,必须重塑理念,以发展的眼光为指导、以人本的理念为根本、以系统的设计为保障,从构建精细化的思想政治教育工作模式、提供多样化的学术发展平台、完善标准化的职业准入制度、建立发展性的职业支持系统、打造自律自治的团队文化、探索规范化的职业退出机制等方面进行制度重构。"
248,,沙军;,高校辅导员科研能力的现状及对策,思想理论教育,2013,No.397,5,90-93,1007-192X,辅导员;科研能力;专业化发展,上海理工大学学工部;,"提升高校辅导员科研能力,加强辅导员队伍专业化、职业化建设,是国家对辅导员队伍建设的根本要求,是辅导员加强学生管理、总结工作规律的重要路径。分析当前高校辅导员科研能力的现状和问题,探索新时期高校辅导员科研能力的培养体系,对于促进高校辅导员的专业化、职业化发展,提升学生工作能力具有重要意义。"
249,,高地;,高校辅导员队伍专业化建设的探索与实践,思想教育研究,2013,No.221,4,47-48,1002-5707,队伍专业化;东北师范大学;队伍结构;优秀辅导员;思想政治教育;培养路径;思想动态;辅导员专业;学生工作部;队伍培训;,东北师范大学党委学生工作部;,"近年来,东北师范大学着力破解辅导员队伍建设过程中的深层次结构性矛盾,打造了层次鲜明、动态递进的队伍建设体系,不断提高辅导员理论水平,明确发展路径,提升工作实效,有力推动了学校辅导员队伍的专业化发展。一、加强队伍工作研修,提高辅导员理论水平"
250,,邱有华;,论基于提升职业幸福感的辅导员队伍建设,思想理论教育,2013,No.403,11,93-95,1007-192X,高校辅导员;职业幸福感;队伍建设,长江师范学院政治与公共管理学院;,"职业幸福感关系着主体的生存状态和工作效率。当前,高校辅导员整体职业幸福感不强是辅导员队伍建设面临的一大问题。提升辅导员的职业幸福感,有利于提高辅导员的工作积极性,促进辅导员的专业成长和学生的成长成才,也有利于辅导员队伍的健康发展。围绕提升职业幸福感,推进辅导员队伍专业化和职业化建设,加强辅导员队伍的内涵建设,注重辅导员工作的外部支持体系建设,能有效促进高校辅导员队伍建设。"
251,,王德华;,目标管理在高校辅导员专业化发展中的应用,黑龙江高教研究,2013,v.31;No.230,6,110-112,1003-2614,目标管理;高校辅导员;专业化发展,中央财经大学应用数学学院;,"目标管理作为一种科学的管理方法,在现代企业中已被广泛采用,而在我国高校辅导员队伍建设的研究或实践中还没有运用这一管理方法的先例。将目标管理体系引入高校辅导员专业化发展的过程中去,能够通过辅导员在微观层面对于自身专业化发展目标的管理,充分调动辅导员的主观能动性与自主发展的心理诉求。文章以调查研究的手法指出了高校辅导员队伍的专业化素质中存在的结构性缺失问题,并有针对性地提出了应用目标管理以克服上述问题,提升辅导员专业化发展效率的方法论。"
252,,,“2O12全国高校辅导员年度人物”风采展示,思想理论教育导刊,2013,No.173,5,145-148,1009-2528,思政;中国大学生;中国教育报;风采展示;工作研究会;新华网;思想政治工作;网络支持;就业实习;博士研究生;,,"[编者按]由教育部思想政治工作司指导,全国高校辅导员工作研究会、中国教育报主办,新华网和中国大学生在线提供网络支持的""全国高校辅导员年度人物""评选活动,自2008年起至今已经成功举办五届,共评选出50位高校辅导员年度人物。""2012全国高校辅导员年度人物""评选活动由思政司组织专家进行通讯评审,从200名"
253,,郑烨;付蓉芬;,高校辅导员能力素质模型建构――以长沙大学城的实证调研为基础,西南交通大学学报(社会科学版),2013,v.14;No.74,2,63-68,1009-4474,高校辅导员;能力素质;工作技能;专业知识;政治素养;人格特质,西安交通大学管理学院;湖南大学法学院;,"运用行为事件访谈法和问卷调查法对长沙大学城三所重点大学的思想政治教育工作专家、一线辅导员、在校本科生和硕士研究生进行实证调研,对调研数据作探索性因子分析和验证性因子分析,结果表明:高校辅导员能力素质包括工作技能素质、专业知识素质、政治素养和人格特质素质4个方面;且政治素养和个人素质在高校辅导员能力素质结构中最为重要。"
254,,吴燕端;,辅导员队伍专业化专家化建设制约因素分析,黑龙江高教研究,2013,v.31;No.231,7,89-91,1003-2614,辅导员队伍;专业化;专家化,梧州学院电子信息工程系;,"辅导员队伍由专业化逐步走向专家化不是一项临时性的工程,而是一项循序渐进的系统性工程,是高等教育社会化、信息化的客观要求,是辅导员谋求发展的必由之路,也是实现大学生思想政治教育实效性的重要保障。可是,当前社会、学校和个人因素却严重地制约了高校辅导员队伍建设的专业化和专家化。故要提高辅导员队伍的专业化水平,培养专家型的辅导员,高校必须对制约辅导员队伍专业化专家化建设的因素进行分析研究,找出问题,以便对症下药,从而真正构建一支专业化和专家化的辅导员队伍。"
255,,粘怡佳;,试论我国高校辅导员法律素质的培养,思想教育研究,2013,No.222,5,89-91,1002-5707,高校辅导员;法律素质;专业化,北京大学法学院;,"法律素质的培养是高校辅导员队伍职业化专业化的要求。高校辅导员应当在大学生高校内部管理、外部行为管理、就业指导服务、思想政治教育、依法治班,法律思维等方面,了解和掌握与其职责相匹配的法律知识。同时,高校也应当为培养辅导员的法律素质创造有利的法治环境,建立完善的培训体系。"
256,,李振跃;,高校辅导员队伍专业化、职业化发展的根本路径,思想教育研究,2013,No.223,6,103-107,1002-5707,辅导员队伍;专业化;职业化,华侨大学学生处;,"高校辅导员队伍发展的根本诉求是实现专业化、职业化发展。辅导员队伍专业化、职业化发展需要以辅导员的问题意识与理论研究、相应的刚性政策与配套制度、辅导员工作的规范化与学科化、辅导员队伍的规模化与稳定性为支撑,同时需要通过赋予辅导员教师身份与待遇,科学设置辅导员岗位等措施,促进辅导员队伍的专业化、职业化发展。"
