,,作者,题名,文献来源,年,卷,期,页码,ISSN,关键词,机构,摘要
1,C,陈岩松;,基于胜任力结构模型的高校辅导员绩效模糊综合评判,江苏高教,2011,No.155,1,102-104,1003-8418,辅导员;胜任力;绩效;模糊评判,南京航空航天大学经济与管理学院;,"结合高校辅导员胜任力结构模型,构建一套合理的、具有较强操作性的评价指标体系,采用模糊综合评价方法对高校辅导员绩效进行评价,可以为辅导员选聘、培训和业绩考核提供可靠依据。"
2,C,姚栋华;,高校职业生涯教育辅导员的专业发展,教育发展研究,2011,v.31;No.302,5,34-37,1008-3855,教师生涯周期;职业生涯发展教育辅导员;专业发展,上海市学生事务中心研究室;,"本文依据教师专业生涯周期的理论,归纳了高校职业生涯教育辅导员所应发挥的作用,分析了这一群体在不同阶段所面临的专业发展需求,并构筑了相应的生涯发展周期。针对这些需求,提出了职业生涯教育辅导员的专业发展策略。"
3,C,杨红君;朱佳;,高校辅导员依恋类型与工作压力、职业倦怠的关系,中国临床心理学杂志,2011,v.19,1,110-112,1005-3611,辅导员;成人依恋;工作压力;职业倦怠,湖南人文科技学院教育科学系;湖南农业大学东方科技学院;,"目的:考察高校辅导员依恋类型与工作压力及职业倦怠的关系。方法:采用关系问卷、工作压力问卷和职业倦怠问卷对322名高校辅导员施测。结果:322名辅导员中,62.1%为安全型依恋,17.7%为忽视型依恋,14.0%为沉迷型依恋,6.2%为恐惧型依恋。安全型依恋的辅导员在工作压力和职业倦怠得分上均显著低于不安全依恋的辅导员,而三种不安全依恋(忽视型、沉迷型和恐惧型)辅导员间的工作压力和职业倦怠没有显著差异。结论:高校辅导员的成人依恋类型对其工作压力和职业倦怠具有显著影响。"
4,C,杜向民;,进一步推进高校辅导员队伍职业化发展路径研究,高校理论战线,2011,,3,48-51,1002-4409,高校辅导员;职业化;路径;推进,长安大学党委;,"当前,在深入推进高校辅导员职业化发展的进程中,一些深层次的问题逐渐显现。因此,必须准确把握高校辅导员职业化建设进程中深层次问题,进一步完善学科专业培养和培训体系,完善制度保证体系,健全职业化推进机制,优化辅导员队伍建设机制和工作模式,建立完善专业协会组织,培育职业文化,加强国际交流,注重形成本国特色,从而大力提升高校辅导员职业化建设的水平。"
5,C,姚军;,论新形势下高校辅导员领导力培养与构建,中国高等教育,2011,No.453,2,41-42,1002-4417,人才培养目标;学生工作;能力体系;综合素质;高等教育环境;斯腾伯格;思想政治教育;校园文化;学生日常思想;价值取向;,盐城工学院;,"当前,高校辅导员已成为学生工作的重要力量,其能力如何,直接关乎高校人才培养目标的实现。而在高校辅导员整个能力体系中,领导力居于核心地位。领导力统领其他各项能力,能够促使辅导员综合素质的不断提高。本"
6,C,陈赞;,高校辅导员管理与心理契约理论应用,中国高等教育,2011,No.452,1,56-58,1002-4417,辅导员管理;心理契约理论;应聘人员;校园文化;人文精神;职业发展空间;行政人员;专业老师;学生工作;教育模式;,苏州大学医学部党工委;,"高校辅导员的选聘成为近年来的一个热点,各大高校的应聘人员之多、学历之高与录取率之低,都令社会瞩目。前些年聘任的辅导员还在调整之中,新一代高学历的辅导员伴随着高校体制变革进入高校教师队伍,带来新"
7,C,王晶;,伦理学视域中的高校辅导员职业幸福及其实现,江苏高教,2011,No.157,3,136-137,1003-8418,高校辅导员;职业幸福;满足,南京邮电大学通信与信息工程学院;,"高校辅导员职业幸福的实现是高校辅导员科学发展观的重要内容之一,由快乐的心理体验和人生重大需要、欲望、目的的实现及生存发展的完满构成,其类型可以分为物质幸福、人际幸福和精神幸福。欲望、才智、努力、机遇、职业道德五要素共同发挥作用,并协调一致,高校辅导员的职业幸福才能较为完满地实现。"
8,C,陈洁;,新时期辅导员队伍文化的内涵及其建设研究――以上海对外贸易学院为例,学术论坛,2011,v.34;No.244,5,205-209,1004-4434,辅导员;文化;内涵,上海对外贸易学院党委;,"加强辅导员队伍文化建设在新的历史时期具有重要的意义,辅导员队伍文化的主要内容是以共识为核心的精神文化、以发展为核心的学习文化、以分享为核心的合作文化。辅导员队伍文化的创建必须充分考虑辅导员队伍的特点,在精神文化的建设上要突出强调形成共同愿景,学习文化的建设要有助于促进博览型学习与专业型学习的结合、团队型学习与个体型学习的结合,合作文化的建设要重在实现一种自然的合作、经常的合作。"
9,C,蒲清平;白凯;赵楠;,高校辅导员职业能力评价研究,高教发展与评估,2011,v.27;No.116,4,95-100,1672-8742,辅导员;职业能力;评价,重庆大学城市建设与环境工程学院;重庆交通大学组织部;,"随着高校辅导员队伍职业化和专业化趋势日益明显,开展高校辅导员职业能力评价对高校辅导员队伍建设和人才培养具有重要作用。以能力本位评价理论和胜任特征模型理论为基础,剖析高校辅导员职业能力评价的层次结构,并对高校辅导员职业能力评价实施提出建议。"
10,C,汪强;汤苗苗;,高校辅导员绩效考核的实施与思考,江苏高教,2011,No.159,5,53-54,1003-8418,高校辅导员;绩效考核;考核制度;考核原则;考核内容,南京工程学院康尼学院;,"高校辅导员队伍是大学生思想政治教育工作一线的组织者、管理者和领导者。辅导员工作对象的复杂性和工作内容的多样性对辅导员自身的素质不断提出新的要求。根据人力资源开发与管理常规,绩效考评的目的是不断提升员工的整体素质,促进员工提高工作效率、效果。对高校辅导员进行绩效考核,不仅是为了年终评优,更重要的是从人力资源开发角度培养一支符合高校人才培养要求的高素质辅导员队伍。通过辅导员岗位绩效考评,为辅导员队伍的岗位培训与开发、奖励制度的制定以及职称评聘、岗位晋升等提供重要依据。"
11,C,孙厚纯;,高校辅导员博客的建立及功效研究,江苏高教,2011,No.159,5,112-113,1003-8418,辅导员博客;高校思想政治工作;网络,南京医科大学基础医学院;,"运用快速发展的现代信息技术加强大学生思想政治教育,是新时期高校学生工作的一大趋势。把博客与辅导员工作相结合,是高校学生思想政治工作的创新之举。建立并运用好辅导员博客,科学规划内容,加强管理,形成网上网下的教育合力,使博客真正成为辅导员工作的有益补充,成为高校学生思想政治工作的有效载体。文章从辅导员博客运行的实践出发,探讨其可行性及特点功能,探索提升其影响力的对策措施,以便充分发挥它在大学生思想政治教育中的作用,为辅导员工作搭建新的载体和平台。"
12,C,张宏如;,高校辅导员职业能力研究,思想理论教育导刊,2011,No.153,9,117-119,1009-2528,辅导员;职业能力;构成体系,常州大学法学与公共管理学院;,"职业能力研究是加强辅导员队伍建设的时代要求。基于心理学、管理学和思想政治教育相结合视角,分析了高校辅导员的职业能力机理,阐述了思想政治标准、工作业务能力和人格动机系统的辅导员职业能力体系,提出了理顺职业管理、构建职业平台、完善职业保障的提升路径,为辅导员队伍的专业化职业化等建设奠定基础。"
13,C,王槊;,提高辅导员的大爱精神和人文修养,中国高等教育,2011,No.464,Z3,41-42,1002-4417,大爱精神;人文修养;角色定位;人格魅力;综合素质;工作能力;学习纪律;育人工作;德育教师;大学文化建设;,上海海事大学浦东工商管理学院;,"办好高等学校,培养学生成为德智体美劳全面发展的社会主义建设者与接班人,需要多方共同努力,高素质的辅导员队伍是其中一支非常重要的力量。面对我国高等教育改革和发展的新形势,广大高校辅导员在坚定理想信念的同时,还应有工作能力不足的危机感,着力提高自身综合素质,尤其需要提升大爱精神和提高人文修养。一、明确角色定位,增强辅导员提高自身素质的紧迫感"
14,C,裴银伟;,高校辅导员激励观的理论意蕴及实践形态,江苏高教,2011,No.160,6,101-102,1003-8418,辅导员建设;激励观;理论意蕴;实践形态,南京财经大学学生处;,"从理论价值向度分析,坚持社会主义核心价值理念是建立辅导员激励观的理论根基,把握先进科学的激励理念是建立辅导员激励观的思想前提,以人为本和人的自我实现是建立辅导员激励观的根本价值取向和终极目标。从实践向度看,科学发展是激励之基,改革是激励之动力。"
15,C,韩冬;毕新华;,高校辅导员职业能力的形成与提升,思想理论教育导刊,2011,No.155,11,122-124,1009-2528,高校辅导员;职业能力;人格魅力;知识管理,东北师范大学思想政治教育研究中心;吉林大学管理学院;,"高校辅导员职业化、专业化的发展,迫切要求辅导员结合自身的特点和优势,形成职业能力。辅导员职业能力有其独特的内涵及特性,可以从以下几个方面提升辅导员职业能力:加强自身的品格修养,形成优秀的人格魅力;做好个人职业生涯规划,明确职业能力培养方向;在学术和工作中形成一技之长,发挥职业能力的优势;完善的个人知识体系,提升综合素质,体现职业能力的整合性;终身学习,敢于创新,保持职业能力的发展性。"
16,C,鲁静;,基于多元评价理论的辅导员职业准入标准,教育发展研究,2011,v.33;No.317,22,77-80,1008-3855,多元评价理论;辅导员;职业准入标准,华东师范大学公共管理学院;,"根据多元评价理论注重发展、多元的评价观,构建辅导员职业准入标准时,应坚持基础性评价标准与核心职业素质相对应、基础性评价标准和发展性评价标准相结合、多维化评价内容与个性化职业潜力相配合、多层次评价标准与多元化主体要求相协调等原则,以促进辅导员队伍职业化、专业化发展,学生的发展,高等教育事业的发展和社会的发展为核心目标。"
17,C,孙启武;郭兰;,岗位特征及相关因素对辅导员工作倦怠的影响,心理科学,2011,v.34;No.193,5,1178-1182,1671-6981,岗位特征;工作倦怠;角色压力;希望;高校辅导员,中国地质大学马克思主义学院应用心理学研究所;,"本研究旨在探讨岗位特征及相关因素对高校辅导员工作倦怠的影响。在高校辅导员培训课堂上共收取有效数据342份。结果表明:(1)岗位特征包括职业价值感、职业无意义感、岗位消极特征和岗位积极特征四个因子;(2)希望和职业价值感能显著正向预测,角色压力能显著负向预测工作倦怠;(3)角色压力在职业无意义感、岗位消极特征、社会支持对工作倦怠的影响中起完全中介作用,而在职业价值感、希望对工作倦怠的影响中起部分中介作用。本研究初步发现了岗位特征及相关因素对辅导员工作倦怠的作用路径。"
18,C,闫科培;,新疆特点的高校辅导员队伍建设初探,新疆师范大学学报(哲学社会科学版),2011,v.32;No.115,6,43-46,1005-9245,新疆特点;高校辅导员;特色化建设,新疆教育学院;,"新疆是我国西北重要的战略安全屏障,战略地位极其重要。推进具有新疆特点的高校辅导员队伍专业化建设,必须重视职业准入、政治素质、职业能力以及专业化的实施路径,保证这支队伍真正成为开展各族大学生思想政治教育工作的骨干力量,进而为新疆高等教育事业的又好又快发展服务。"
19,C,客洪刚;,高校辅导员队伍与思政课教师队伍交流机制研究,教育科学,2011,v.27;No.126,6,70-73,1002-8064,高校辅导员;思政课教师;思想政治教育;交流,东北师范大学马克思主义学院;,"高校辅导员队伍和思想政治理论课教师是培养未来社会主义事业的建设者和接班人的重要力量,加强队伍双方的交流与合作,探究其交流机制十分必要。限于高校辅导员队伍和思想政治理论课教师自身和高校教学与管理机制、体制的原因,还存在制约双方相互交流的因素。但通过二者相互兼职、工作会议平台、科研合作、制度保障等机制和方法是可以实现双方顺畅交流的。"
20,C,孙信丽;徐伟;林龙圳;崔建国;,进一步加强研究生专职辅导员队伍建设的思考,学位与研究生教育,2011,No.229,12,45-48,1001-960X,研究生;专职辅导员;队伍建设,北京林业大学党委研究生工作部;北京林业大学研究生就业办公室;北京林业大学团委研究生工作部;,"以北京地区部分普通高校研究生专职辅导员、研究生管理人员、研究生为调查对象,采取问卷调查、座谈、访谈等方式,对高校研究生专职辅导员队伍工作现状进行调查分析,总结了研究生专职辅导员队伍建设存在的问题,提出了进一步加强研究生专职辅导员队伍建设的对策和建议。"
21,C,严毛新;,高校辅导员承担思想政治理论课教学方式研究,中国青年政治学院学报,2011,v.30;No.152,1,66-69,1002-8919,高校辅导员;思想政治理论课;教学方式,浙江工商大学杭州商学院;,"与专职教师相比,辅导员更了解学生中存在的各类问题,更明白学生所思所想,更容易将理论与实践相结合;但他们年纪轻,流动性大,教学经验也不足。高校辅导员承担思想政治理论课采用""独立承担一门课""的方式不利于提高整体授课质量,也不利于辅导员队伍建设,应采取""分专题合作式重实践教学""方式,同时完善辅导员教师的选聘机制、考核培训机制和实践教学运行机制。"
22,C,叶绍灿;张效英;,学术研究视阈下的高校辅导员队伍建设,中国青年政治学院学报,2011,v.30;No.153,2,43-47,1002-8919,高校辅导员;学术研究;学术能力,合肥工业大学生物与食品工程学院;合肥工业大学党政办公室;,"高校辅导员从事学术研究有利于进一步加强大学生思想政治教育,提高辅导员的身份认同、工作水平,完善辅导员的知识结构,促进辅导员的专业化、职业化。目前的问题是:辅导员学术研究的意识不强,研究能力较弱,研究水平不高,高校中还没有形成辅导员进行学术研究的良好氛围。为此,高校必须加强相关学科建设,完善职称评聘,增强科研意识,加强团队建设等,促进辅导员学术研究水平的提高。"
23,C,倪培强;,新疆高校辅导员队伍建设探析,新疆师范大学学报(哲学社会科学版),2012,v.33;No.116,1,94-100,1005-9245,新疆高校;辅导员队伍;探析,新疆师范大学自治区大学生思想政治教育研究中心;,"新疆高校辅导员队伍在贯彻落实党的教育方针、坚持社会主义办学方向、培养社会主义事业合格建设者和可靠接班人、维护高校安全稳定中发挥着不可替代的重要作用。理清新疆高校辅导员队伍建设现状,找准存在的问题,并就提高辅导员队伍整体素质,建立和完善辅导员队伍管理制度和运行机制等进行研究,对进一步加强和改进辅导员队伍建设具有现实意义。"
24,C,杨延红;左红梅;,高校辅导员工作的四个重心,江苏高教,2012,No.161,1,125-126,1003-8418,高校;辅导员;角色定位;辅导员工作,扬州大学信息工程学院;扬州大学外国语学院;,"《普通高等学校辅导员队伍建设规定》明确了高校辅导员的角色,但在实际工作中,高校辅导员仍存在角色定位不准、工作热情不高和工作思路不清等问题。高校辅导员应当正确理解和把握自己的角色定位,担当起学生思想政治的教育者、教育管理的组织者、学生事务的管理者、学习生活的指导者和健康成长的服务者等角色,确立""以学生为本""的工作理念,切实有效地做好学生的教育、管理、指导、服务工作,为高校的人才培养作出应有的贡献。"
25,C,沈伟;,美国教育问责背景下的教学辅导员:回顾与反思,全球教育展望,2012,v.41;No.295,2,61-66+60,1009-9670,问责;教学辅导员;角色,香港中文大学教育行政与政策系;,"21世纪初美国颁布《不让一个孩子掉队》法案,此后,教学辅导员大量兴起。作为教学领导的一员,教学辅导员在促进学校能量建设、教师专业发展方面被寄予厚望。现实中,教学辅导员对各类角色有所选择和理解,不仅表现出促进者、中介者的角色,并在学习的过程中不断建构新的角色。在形成角色的过程中,教学辅导员受学区、学校等多重因素的影响。教学辅导员若要促进教学改进,必须首先推动学校的内部问责,并在教育系统中获得清晰的定位。"
26,C,杨建义;,高校辅导员专业定位、标准及其达成,福建师范大学学报(哲学社会科学版),2012,No.172,1,14-19,1000-5285,辅导员;思想政治教育;专业定位;专业标准,福建师范大学学生工作部;,"随着经济社会和高等教育的发展,思想政治教育已经从政治逻辑逐渐向专业逻辑转移,辅导员专业化成为队伍建设的内在诉求和时代要求。在辅导员专业化初始阶段,要着力解决辅导员专业定位、专业标准及其实现路径问题,从而推进辅导员队伍的健康、持续发展。"
27,C,闪茜菁;,辅导员工作视域下的大学生健康人格塑造,思想理论教育导刊,2012,No.157,1,114-117,1009-2528,辅导员;大学生;健康人格;塑造;自我意识,安庆师范学院政法学院;,"大学生健康人格塑造是大学生成长成才的关键环节,也是高校辅导员日常工作的重要内容。作为大学生的人生导师和健康成长的知心朋友,辅导员应当引领学生在学会求知、学会生活、学会做事、学会发展中提升自我认识、自我体验、自我控制、自我实现能力,塑造健康人格。"
28,C,陈娟;,从组织职业生涯管理看高校辅导员队伍建设,江苏高教,2012,No.162,2,68-69,1003-8418,辅导员;组织职业生涯管理;队伍建设,南京工业大学交通学院;,"辅导员是高等学校教师队伍和管理队伍的重要组成部分,但在队伍方面存在职业化、专业化建设不足的问题,难以适应新形势下高校学生工作的要求。文章从组织职业生涯管理的角度,以学校为主体,探讨高校辅导员队伍职业化、专业化发展在制度化、体系化方面的重点与策略。"
29,C,邹群;田铁杰;,高校辅导员职业倦怠的现状分析与对策建议,教育科学,2012,v.28;No.127,1,71-74,1002-8064,高校辅导员;职业倦怠;问卷调查,辽宁师范大学教育学院暨田家炳教育书院;沈阳师范大学教育学院;,"目的本研究试图了解高校辅导员的职业倦怠的现状,探索改善高校辅导员的职业倦怠与减轻职业压力的有效途径和措施。方法采用高校辅导员职业倦怠程度调查问卷对80名辅导员进行问卷调查。结果:约有50%的辅导员有着不同程度的倦怠表现,已婚辅导员比未婚辅导员更容易产生职业倦怠(χ2(1,80)=10.208,p0.05),不同学历的辅导员,其职业倦怠情况没有显著差异。结论:高校辅导员的职业倦怠情况不容忽视,必须通过一系列措施改善高校辅导员职业倦怠的现状。"
30,C,蒋德勤;,高校加强辅导员队伍建设的三个维度,思想理论教育导刊,2012,No.158,2,107-109,1009-2528,高校;辅导员;队伍;建设,安徽科技学院思想政治理论课教研部;,"当前,高校应从深化对辅导员队伍建设重要性的认识、坚持专业化职业化队伍建设方向、找准队伍建设突破口这三个维度,进一步加强辅导员队伍建设工作,不断提升辅导员队伍建设水平,适应高等教育形势发展和人才培养对辅导员队伍建设的新要求。"
31,C,谢继华;木帕里色;,关于高校辅导员博客建设的探索,思想理论教育导刊,2012,No.158,2,110-112,1009-2528,高校辅导员;博客建设;理论与实践,电子科技大学政治与公共管理学院;,"当前高校辅导员博客建设发展到有组织、有计划的重点推进阶段,针对辅导员博客存在的定位和理解存在偏差,内容建设、管理参差不齐亟需规范和平台建设亟需完善等问题,加强辅导员博客建设要正确把握全面性、积极主动和参与性原则,提高建设优秀辅导员博客的技能、加强对博客的监管力度。"
32,C,蔡茂华;李尚蒲;,研究生导师与辅导员合力育人机制的构建,研究生教育研究,2012,No.8,2,44-48,2095-1663,研究生思想政治教育;导师;辅导员;合力育人机制,华南农业大学党委研究生工作部;,"研究生导师和辅导员是研究生思想政治教育队伍的主体,针对两个主体之间存在沟通不充分、工作职责不清晰、工作合力形成不足的问题,分析研究生导师与辅导员互动沟通交流的特点和双方沟通不足的主要原因,提出构建研究生合力育人机制:界定导师和辅导员育人权责、明确双方沟通的主要内容、建立声誉机制调动导师和辅导员主动参与研究生思想教育的积极性,增强合力育人的效果。"
33,C,伍慷;,高校辅导员团队工作模式及效用,高教探索,2012,No.124,2,127-130,1673-9760,辅导员职业化;团队;团队工作模式,广州美术学院版画系;,"辅导员团队工作模式是一种全新的工作模式,具有独立的两级团队组织与职级序列,有清晰明确的岗位职责,具有""纵""、""横""的发展空间。它解决了辅导员发展的职业化、专业化问题,消解了辅导员的职业倦怠,提高了辅导员的职业能力,使辅导员工作具有了职业价值核心,并能形成真正的辅导员文化,塑造职业灵魂。"
34,C,徐晓宁;,新形势下高校辅导员队伍专业化建设的难点及对策,思想理论教育导刊,2012,No.160,4,115-119,1009-2528,辅导员;专业化;难点;对策,安庆师范学院学生处;,"当前学生工作的""瓶颈""问题,在于思想政治教育的精细化要求与学生发展的个性化选择之间的矛盾。在这一背景下,专业化成为提高辅导员队伍整体素质与工作能力的方向性选择。目前的辅导员队伍专业化建设还存在着观念障碍、专业意识模糊、不平衡性问题突出、体制机制薄弱等诸多问题,影响了专业化评价、定位、环境和效果。解决这些问题,必须提高专业门槛、提升专业素质、理清专业层次、凝练专业价值,建立起科学的选配机制、培养机制、管理机制和发展机制。"
35,C,吴建明;,青年辅导员践行“五者”要求的理论与实践,中国青年研究,2012,No.195,5,113-116,1002-9931,青年辅导员;践行;五者;思考,浙江省团校;,"青年辅导员是少年儿童的亲密伙伴和指导者,青年辅导员的党性修养直接影响着少年儿童思想政治素质的提高。青年辅导员要围绕少先队的根本任务,团结、教育、引导少年儿童,不断提高自身的职业素质。本文对青年辅导员在新的历史条件下如何践行""五者""作一些思考。"
36,C,吕吉;,试论高校辅导员专业化发展的制约因素,江苏高教,2012,No.163,3,95-96,1003-8418,高校辅导员;专业化;制约因素,滁州学院教育科学学院;,"高校辅导员走向专业化发展是当前我国高等教育进入大众化阶段的时代要求和发展趋势。然而,在当前我国高校的现实处境下,高校辅导员队伍要实现专业化发展还存在诸多的制约性因素,包括动力因素、培训因素、机制保障因素等。对制约高校辅导员专业化的因素进行分析,希望能够有助于深化对高校辅导员专业化的认识和推进高校辅导员专业化的发展进程。"
37,C,杨清刚;郑祥福;,高校教师“去倦怠”研究――以辅导员为例,江淮论坛,2012,No.252,2,189-191,1001-862X,高校辅导员;职业倦怠;对策建议,浙江水利水电专科学校;浙江师范大学法政学院;,"高校辅导员被认为是高强度、高压力职业,容易产生职业倦怠感。去除高校辅导员职业倦怠,对于增强高校教育能力、提升大学生思想品德、促进辅导员身心健康等具有重要的现实意义。文章分析了导致高校辅导员职业倦怠的成因,并提出了对策建议。"
